{"profile":"task_activation","action":"recover_activation","mode":"standalone","activation":{"task_id":"demo","task_ref":".trellis/tasks/demo","lifecycle_generation":0,"planning_result_id":"planning:aaaaaaaaaaaaaaaaaaaaaaaaaaaaaaaaaaaaaaaaaaaaaaaaaaaaaaaaaaaaaaaa","selected_base_ref":"main","continuity":{"kind":"base_current","task_head":"aaaaaaaaaaaaaaaaaaaaaaaaaaaaaaaaaaaaaaaa","base_head":"aaaaaaaaaaaaaaaaaaaaaaaaaaaaaaaaaaaaaaaa"},"session_mode":"explicit_task_mode"}}
